,Header,Summary,Detail,Link,Category,CreationDate
9,"Rs1.6bn approved for rehabilitation of universities in KP, Balochistan, Sindh",ISLAMABAD: An amount of Rs1.6 billion has been approved by the Higher Education Development in Pakistan (HEDP) for...,"ISLAMABAD: An amount of Rs1.6 billion has been approved by the Higher Education Development in Pakistan (HEDP) for rehabilitation of universities in Khyber Pakhtunkhwa, Balochistan and Sindh.
The HEDP approved this allocation in its sixth Steering Committee meeting at the Higher Education Commission (HEC) Secretariat, Islamabad, according to a press release issued by HEC on Thursday.
HEDP is a five-year national project (2019/20 – 2023/24) implemented by HEC to expand upon its key higher education priorities. The committee members reviewed the progress made so far on the project. An official of HEC said that HEDP is a World Bank funded programme which is being executed by HEC.
Executive director of HEC Dr Shaista Sohail chaired the said meeting. In her opening remarks, she said: “Like every project, this project also has yearly financial and physical targets. 
“At the end of every year in June, all project deliverables are checked and validated. These evaluation reports are then shared with the World Bank to make financial disbursements to the government for the project. I am glad that despite the financial, hiring and leadership challenges, the project as of today still stands at good financial and physical progress.’’
Project Coordinator Prof Dr Mehmood ul Hassan Butt gave an overview of the project, its history, progress, future plans, and recently recruited staff. He briefed the committee members about the key project initiatives, including physical and financial progress of all 11 project indicators called Performance-Based Conditions (PBCs). 
In addition to this, members were apprised that the project is being restructured to support flood-related damages to institutions in which a cost of Rs1.6 billion will be allocated for 14 worst affected universities/ institutes of Sindh, Khyber Pakhtunkhwa and Balochistan.
Technical heads of project components updated members on the progress of each of the six components of the project including 44 research grants awarded this year. 
In addition, 15 Innovator Seed Funding (ISF) grants are also being given to start-ups. HEDP is also in the process of finalising memorandums of understanding (MoUs) for the establishment of Quality Enhancement Cells in Affiliated Colleges (QECACs) of 22 universities. 
It was further discussed that the new Undergraduate Education Policy (UEP) has now been finalised, incorporating feedback from all vice chancellors across Pakistan. The faculty of KP is already trained on new UEP implementation while the plan for other provinces/regions will be rolled out very soon. 
The IT component head of the project briefed members on the expansion of the Pakistan Education Research Network (PERN) in another 71 HEIs, development of Pakistan EdX and the launch of Enterprise Resource Systems for 25 HEIs. 
Bids have been reviewed and a final decision will be made in January 2023. Procurement processes for several national IT initiatives are also underway.
Published in Dawn, December 30th, 2022
",https://www.dawn.com/news/1728889/rs16bn-approved-for-rehabilitation-of-universities-in-kp-balochistan-sindh,islamabad,2022-12-30
10,Woman shot dead allegedly by brothers,"ISLAMABAD: A woman was shot dead in the capital allegedly by her brothers, police said on Thursday.

The victim was...","ISLAMABAD: A woman was shot dead in the capital allegedly by her brothers, police said on Thursday.
The victim was identified as Noor Almina, a native of Buner. According to her husband Shams-ul-Iqbal, he tied the knot with her eight years ago, against the will of her family who threatened them. He said this is why they moved away.
Later, they shifted to the capital and Iqbal became a security guard to earn a livelihood for his family, police said, adding that the victim’s brothers found out where they lived and shot her dead.
The landlord’s brother informed Iqbal about the killing and when he reached home, he found his wife’s lifeless body. He alleged that his brother-in-laws were behind the murder.
The police registered a case in response of the complaint lodged by him and started investigation.
Meanwhile, a woman died after being hit by a vehicle in Rawat, police said. The victim was identified as Mahjabeen Akhter, they said, adding that a speeding car hit her while she was crossing a road in the area of Rawat.
As a result, she fell on the road and sustained multiple injuries, while the car driver escaped from the spot, the police said, adding that later she was shifted to the hospital where she was pronounced dead. 
Published in Dawn, December 30th, 2022
",https://www.dawn.com/news/1728888/woman-shot-dead-allegedly-by-brothers,islamabad,2022-12-30
